Question,Answer
Hi,"Hi, how are you today? How can I assist you today?"
"Hello, how can I assist you today?",Hi! I'm here to help you with anything you need. What can I do for you?
What perfumes do you recommend for women?,"I recommend trying Chanel No. 5, Dior J'adore, or Marc Jacobs Daisy for women."
Can you suggest a perfume for a formal event?,"For a formal event, you might like Yves Saint Laurent Black Opium or Chanel Coco Mademoiselle."
What are the best-selling perfumes this season?,"The best-selling perfumes this season include Gucci Bloom, Tom Ford Black Orchid, and Jo Malone London."
How can I track my order?,You can track your order by logging into your account and checking the 'Order Status' section.
What is the return policy for perfumes?,"Our return policy allows returns within 30 days of purchase, provided the perfume is unopened."
Can I get a discount on bulk purchases?,"Yes, we offer discounts on bulk purchases. Please contact our sales team for more details."
How do I know if a perfume is original?,"To ensure a perfume is original, buy from reputable retailers and check for authenticity seals."
Can you suggest a perfume for men?,"For men, I suggest Dior Sauvage, Bleu de Chanel, or Giorgio Armani Acqua di Gio."
What is the difference between Eau de Parfum and Eau de Toilette?,Eau de Parfum has a higher concentration of fragrance oils and lasts longer than Eau de Toilette.
How long does the fragrance last?,"The fragrance typically lasts between 4 to 8 hours, depending on the type and ingredients."
Can I get a sample before purchasing?,"Yes, we offer samples for many of our perfumes. Please visit our samples section on the website."
How should I store my perfume?,"Store your perfume in a cool, dry place away from direct sunlight to maintain its quality."
What ingredients are in this perfume?,You can find the ingredients list on the product page or packaging of the perfume.
Are there any perfumes without alcohol?,"Yes, we have a selection of alcohol-free perfumes. Please check our 'Alcohol-Free' section."
How can I change my shipping address?,You can change your shipping address by going to your account settings and updating your information.
What payment methods do you accept?,"We accept all major credit cards, PayPal, and other secure payment methods."
Can I cancel my order after placing it?,Orders can be canceled within an hour of placing them. Please contact our support team for assistance.
Do you offer gift wrapping services?,"Yes, we offer gift wrapping services at checkout. You can select this option when placing your order."
Can you recommend a perfume for a summer day?,"For a summer day, try light and fresh scents like Dolce & Gabbana Light Blue or Versace Bright Crystal."
How can I join your loyalty program?,You can join our loyalty program by signing up on our website. Earn points with every purchase!
Do you ship internationally?,"Yes, we ship to many countries worldwide. Please check our shipping policy for more details."
What should I do if my perfume arrives damaged?,"If your perfume arrives damaged, please contact our support team immediately for a replacement or refund."
Can I return a used perfume?,"Unfortunately, we cannot accept returns on used perfumes due to hygiene reasons."
Do you offer express shipping?,"Yes, we offer express shipping options at checkout for faster delivery."
How do I apply perfume for the best results?,"Apply perfume to pulse points like wrists, neck, and behind ears for long-lasting fragrance."
What are niche perfumes?,"Niche perfumes are exclusive, high-quality fragrances made by specialized perfumeries."
Do you have perfumes suitable for sensitive skin?,"Yes, we offer perfumes formulated for sensitive skin. Please check our 'Sensitive Skin' section."
Can I combine different perfumes?,"Yes, you can layer perfumes to create a unique scent. Start with lighter scents and add stronger ones."
What size bottles do you offer?,"We offer various sizes, including 30ml, 50ml, and 100ml bottles."
How often do you release new perfumes?,We release new perfumes seasonally. Stay updated by subscribing to our newsletter.
Are your perfumes cruelty-free?,"Yes, all our perfumes are cruelty-free and not tested on animals."
What is the best way to sample multiple perfumes?,You can order a sample set from our website to try multiple perfumes before buying full-sized bottles.
Can I personalize my perfume bottle?,"Yes, we offer personalization services for select perfume bottles. Please check our personalization section."
Do you have a physical store?,"Yes, we have physical stores. Please check our store locator for the nearest location."
Can I get recommendations based on my previous purchases?,"Yes, log into your account to get personalized recommendations based on your purchase history."
"Hi, what perfumes do you recommend for teenagers?","For teenagers, I recommend light and fresh scents like Marc Jacobs Daisy or Calvin Klein CK One."
"Hello, can you suggest a gift for a perfume lover?","For a perfume lover, I suggest a gift set featuring a variety of mini perfumes or a personalized bottle."
"Hi, do you have any eco-friendly perfumes?","Yes, we offer a range of eco-friendly perfumes. Please check our 'Eco-Friendly' section."
"Hello, what are the ingredients in natural perfumes?","Natural perfumes are made with essential oils, plant extracts, and other natural ingredients. You can find the full list on the product page."
"Hi, can you help me find a perfume similar to my favorite scent?","Yes, please tell me the name of your favorite scent, and I'll suggest some similar options."
"Hello, what are your most popular unisex perfumes?","Our most popular unisex perfumes include Jo Malone London Wood Sage & Sea Salt, and Le Labo Santal 33."
"Hi, how can I leave a review for a perfume?","You can leave a review by logging into your account, going to the product page, and submitting your review."
"Hello, what is your best perfume for winter?","For winter, I recommend warm and spicy scents like Tom Ford Tobacco Vanille or Viktor & Rolf Spicebomb."
"Hi, can you recommend a long-lasting perfume?","For a long-lasting perfume, try Lancome La Vie Est Belle or Paco Rabanne 1 Million."
"Hello, how do I contact customer service?",You can contact our customer service through the 'Contact Us' page on our website or by calling our hotline.
"Hi, do you have vegan perfumes?","Yes, we offer a selection of vegan perfumes. Please check our 'Vegan' section for more details."
"Hello, can you suggest a perfume for a romantic evening?","For a romantic evening, try seductive scents like Chanel Chance or YSL Mon Paris."
"Hi, how do I use a perfume sample?",Apply the perfume sample to your wrist or neck to test the fragrance. Samples are perfect for trying out a scent before buying a full bottle.
"Hello, what perfumes are best for daytime wear?","For daytime wear, light and fresh scents like Versace Bright Crystal or Marc Jacobs Daisy are great options."
"Hi, can you recommend a perfume for a birthday gift?","For a birthday gift, consider personalized perfumes or gift sets featuring popular scents like Chanel No. 5 or Dior J'adore."
"Hello, do you offer free samples?",We offer free samples with certain purchases and promotions. Check our website for current offers.
"Hi, what is your policy on exchanging perfumes?",Our exchange policy allows you to exchange unopened perfumes within 30 days of purchase. Contact our support team for assistance.
"Hello, what are the top notes in this perfume?",The top notes of a perfume are the initial scents you smell when you first apply it. Check the product page for specific top notes information.
"Hi, can you suggest a perfume for a casual outing?","For a casual outing, try light and airy scents like Dolce & Gabbana Light Blue or Burberry Brit."
"Hello, how do I redeem a discount code?",You can redeem a discount code at checkout by entering the code in the designated field.
"Hi, do you offer gift cards?","Yes, we offer gift cards in various amounts. You can purchase them on our website."
"Hello, what are your store hours?",Our store hours vary by location. Please check our store locator on the website for specific hours.
"Hi, can you help me choose a perfume based on my preferences?","Yes, please tell me about your fragrance preferences, and I'll suggest some options that match your taste."
"Hello, do you have any limited edition perfumes?","Yes, we offer limited edition perfumes from time to time. Check our 'Limited Edition' section for current offerings."
"Hi, what is the best way to layer perfumes?","Layering perfumes involves applying different scents in a sequence. Start with a base note, followed by a middle note, and finish with a top note for a unique fragrance."
"Hello, how do I update my account information?",You can update your account information by logging into your account and editing your profile settings.
"Hi, do you offer student discounts?","Yes, we offer student discounts. Please provide a valid student ID at checkout to receive the discount."
"Hello, can you recommend a perfume for a beach day?","For a beach day, try fresh and aquatic scents like Davidoff Cool Water or Acqua di Gioia by Giorgio Armani."
"Hi, what are the benefits of joining your loyalty program?","Joining our loyalty program offers benefits such as earning points on purchases, exclusive discounts, and early access to new releases."
"Hello, do you have any perfumes with floral notes?","Yes, we have a wide range of perfumes with floral notes. Check our 'Floral' section for options."
"Hi, can you suggest a perfume for a night out?","For a night out, try bold and alluring scents like Tom Ford Noir or Jean Paul Gaultier Scandal."
"Hello, how do I subscribe to your newsletter?",You can subscribe to our newsletter by entering your email address in the subscription box on our website.
"Hi, do you offer complimentary gift wrapping?","Yes, we offer complimentary gift wrapping on select items. You can choose this option at checkout."
"Hello, what is your most popular perfume?","Our most popular perfume is Chanel No. 5, known for its timeless elegance and classic scent."
"Hi, how do I apply a rollerball perfume?","Apply a rollerball perfume by rolling it onto pulse points like your wrists, neck, and behind your ears."
"Hello, can you recommend a perfume for winter?","For winter, try warm and cozy scents like Viktor & Rolf Flowerbomb or Burberry London."
"Hi, do you have any perfumes with woody notes?","Yes, we have perfumes with woody notes. Check our 'Woody' section for options like Tom Ford Oud Wood or Gucci Guilty."
"Hello, how can I find out about upcoming sales?",Sign up for our newsletter or follow us on social media to stay updated on upcoming sales and promotions.
"Hi, what are the middle notes in this perfume?","The middle notes, or heart notes, are the main body of the fragrance. Check the product page for specific middle notes information."
"Hello, can you suggest a perfume for a special occasion?","For a special occasion, try luxurious and sophisticated scents like Creed Aventus or Hermès Terre d'Hermès."
"Hi, do you offer free shipping?",We offer free shipping on orders over a certain amount. Check our shipping policy for more details.
"Hello, how do I sign in to my account?",You can sign in to your account by clicking the 'Sign In' button on the top right corner of our website.
"Hi, can you recommend a perfume for a spring day?","For a spring day, try fresh and floral scents like Marc Jacobs Daisy or Jo Malone Peony & Blush Suede."
"Hello, what is the best way to store perfume samples?","Store perfume samples in a cool, dry place away from direct sunlight to maintain their quality."
"Hi, do you offer corporate gifts?","Yes, we offer corporate gifts. Please contact our sales team for more details and options."
"Hello, how do I reset my password?",You can reset your password by clicking the 'Forgot Password' link on the sign-in page and following the instructions.
"Hi, what are the base notes in this perfume?",The base notes are the lasting scents that appear after the top and middle notes evaporate. Check the product page for specific base notes information.
"Hello, can you recommend a perfume for a festive event?","For a festive event, try vibrant and joyful scents like Chanel Chance Eau Tendre or Viktor & Rolf Bonbon."
"Hi, do you offer fragrance consultations?","Yes, we offer fragrance consultations. Please book an appointment through our website."
"Hello, what are the benefits of using a solid perfume?","Solid perfumes are portable, easy to apply, and often have a longer shelf life. They are also a great option for travel."
"Hi, do you have any perfumes with citrus notes?","Yes, we have perfumes with citrus notes. Check our 'Citrus' section for options like Dolce & Gabbana Light Blue or Clinique Happy."
"Hello, what are the top perfumes for men?","For men, the top perfumes are Dior Sauvage, Bleu de Chanel, and Armani Code."
"Hi, how can I earn points in the loyalty program?","You can earn points by making purchases, writing reviews, and referring friends."
"Hello, do you have any perfumes inspired by nature?","Yes, we have nature-inspired perfumes like Jo Malone Wood Sage & Sea Salt and Maison Margiela Replica Beach Walk."
"Hi, can you suggest a perfume for a graduation gift?","For a graduation gift, consider fresh and youthful scents like Marc Jacobs Daisy or Dolce & Gabbana Light Blue."
"Hello, what are the latest perfume releases?","The latest releases include Chanel Gabrielle Essence, Yves Saint Laurent Libre, and Gucci Mémoire d'une Odeur."
"Hi, can you recommend a perfume for an anniversary gift?","For an anniversary gift, try romantic and luxurious scents like Chanel Coco Mademoiselle or Dior J'adore."
"Hello, do you offer perfume samples with every purchase?","Yes, we offer complimentary samples with every purchase, subject to availability."
"Hi, what perfumes are popular among teenagers?","Popular perfumes among teenagers include Ariana Grande Cloud, Victoria's Secret Bombshell, and Hollister Wave."
"Hello, can you suggest a perfume for a beach vacation?","For a beach vacation, try aquatic and fresh scents like Davidoff Cool Water or Escada Aqua Del Sol."
"Hi, what are the best perfumes for evening wear?","For evening wear, try elegant and sophisticated scents like Tom Ford Black Orchid or Givenchy L'Interdit."
"Hello, do you have any perfumes with gourmand notes?","Yes, we have perfumes with gourmand notes like Thierry Mugler Angel and Prada Candy."
"Hi, how can I redeem my loyalty points?",You can redeem your loyalty points at checkout by selecting the option to apply points to your purchase.
"Hello, what is the difference between parfum and cologne?","Parfum has a higher concentration of fragrance oils and lasts longer, while cologne is lighter and more refreshing."
"Hi, can you recommend a perfume for a work environment?","For a work environment, try subtle and professional scents like Chanel Chance Eau Fraîche or Burberry Brit."
"Hello, do you offer fragrance layering sets?","Yes, we offer fragrance layering sets that include complementary scents for a personalized fragrance experience."
"Hi, what is the best way to apply perfume?","The best way to apply perfume is to spray it on pulse points like wrists, neck, and behind the ears."
"Hello, can you recommend a perfume for a winter day?","For a winter day, try warm and cozy scents like Tom Ford Tobacco Vanille or Burberry London."
"Hi, do you have any perfumes with musk notes?","Yes, we have perfumes with musk notes like Narciso Rodriguez For Her and Maison Francis Kurkdjian Baccarat Rouge 540."
"Hello, how can I receive updates on new products?",You can receive updates on new products by subscribing to our newsletter and following us on social media.
What is your service time?,"For service time, please visit out contact page."
time,Could you please specify the question?
"Thanks, thank you.",You are welcome. How was my service today? Give us feedback.
